{
  "$schema": "http://json-schema.org/draft-07/schema#",
  "$id": "https://example.org/schemas/agent/instance.job-released.schema.json",
  "title": "Agent Instance Job Released Payload",
  "type": "object",
  "additionalProperties": false,
  "required": [
    "poolId",
    "instanceId",
    "jobId"
  ],
  "properties": {
    "poolId": {
      "type": "string",
      "minLength": 1,
      "description": "Stable identifier of the pool or runner group."
    },
    "poolName": {
      "type": [
        "string",
        "null"
      ],
      "description": "Display name of the pool or runner group."
    },
    "instanceId": {
      "type": "string",
      "minLength": 1,
      "description": "Stable identifier of the agent or runner instance that released the job."
    },
    "instanceName": {
      "type": [
        "string",
        "null"
      ],
      "description": "Display name or hostname for the instance."
    },
    "jobId": {
      "type": "string",
      "minLength": 1,
      "description": "Provider-specific identifier for the released job."
    },
    "jobResult": {
      "type": [
        "string",
        "null"
      ],
      "enum": [
        "succeeded",
        "failed",
        "canceled",
        "skipped",
        "timed-out",
        null
      ],
      "description": "Optional normalized outcome of the released job."
    },
    "jobDurationMs": {
      "type": [
        "integer",
        "null"
      ],
      "minimum": 0,
      "description": "Optional job run duration in milliseconds."
    },
    "details": {
      "type": "object",
      "additionalProperties": true,
      "description": "Provider-specific metadata for this lifecycle event, such as exit codes or stage summaries."
    }
  }
}