{
  "poolId": "prod-linux",
  "poolName": "Production Linux Agent Pool",
  "instanceId": "agent-vm-001",
  "instanceName": "agent-vm-001.contoso.com",
  "jobId": "run-20260421-00042",
  "jobResult": "succeeded",
  "jobDurationMs": 145230,
  "details": {
    "workflowName": "Build and Test",
    "runNumber": 42,
    "stageName": "Test",
    "exitCode": 0
  }
}
